Skill,Related Skills,Explanation,Popularity Trend,Industry Focus,Resources
Sales Operations,"Data Analysis, CRM, Process Optimization","Supports sales teams by optimizing processes and managing data, enhances sales efficiency.",Growing,"Sales, Marketing",Sales Operations Basics
Crowdfunding,"Marketing, Financial Planning, Community Engagement","Facilitates fundraising through collective investment, enhances project support and visibility.",Growing,"Startups, Nonprofits",Crowdfunding Basics
Digital Supply Chain,"IoT, Data Analytics, Logistics","Integrates digital technologies into supply chain management, enhances efficiency and transparency.",High Growth,"Manufacturing, Retail",Digital Supply Chain Basics
Voice User Interface Design,"UX Design, Interaction Design, Programming","Designs interfaces for voice-activated systems, enhances user experience in smart devices.",Growing,Tech,Voice UI Design Basics
Cultural Competency,"Diversity Training, Communication, Global Awareness","Enhances understanding and respect for diverse cultures, supports inclusive environments.",Growing,All industries,Cultural Competency Basics
Artificial Intelligence Ethics,"Fairness, Transparency, Accountability","Addresses ethical challenges in AI development and use, promotes responsible technology practices.",High Growth,"Tech, Policy",AI Ethics Basics
Nutritional Science,"Dietary Analysis, Public Health, Food Safety","Studies the impact of nutrition on health, informs dietary recommendations and policies.",Growing,"Healthcare, Education",Nutritional Science Basics
Intellectual Property Management,"Copyright Law, Patents, Licensing","Protects intellectual property rights, enhances compliance and monetization strategies.",Stable,All industries,Intellectual Property Basics
Sales Forecasting,"Data Analysis, Market Research, Financial Modeling","Predicts future sales trends, informs strategic decision-making and resource allocation.",Growing,"Sales, Finance",Sales Forecasting Basics
Content Curation,"Research, Digital Marketing, Social Media","Selects and organizes relevant content for specific audiences, enhances engagement and information sharing.",Growing,"Marketing, Education",Content Curation Basics
360-Degree Feedback,"Performance Management, Coaching, Team Development","Gathers comprehensive feedback from various sources, enhances employee development and performance.",Growing,"HR, All industries",360-Degree Feedback Basics
Corporate Training,"Instructional Design, Communication, Evaluation","Develops training programs for employees, enhances skills and organizational performance.",Growing,All industries,Corporate Training Basics
User Experience Research,"Qualitative Methods, Data Analysis, Prototyping","Conducts research to understand user interactions, informs design improvements.",Growing,"Tech, Design",UX Research Basics
Outreach Strategies,"Community Engagement, Networking, Marketing","Develops methods to connect with target audiences, enhances visibility and support for initiatives.",Growing,"Nonprofits, Education",Outreach Strategies Basics
Digital Transformation in Education,"E-Learning, Change Management, Technology Integration","Integrates digital tools into educational practices, enhances learning experiences and outcomes.",High Growth,Education,Digital Transformation in Education Course
Crisis Management,"Risk Assessment, Communication, Strategic Planning","Develops plans for managing crises, enhances organizational resilience and response effectiveness.",Growing,All industries,Crisis Management Basics
Online Reputation Management,"Digital Marketing, SEO, Communication","Manages and improves a brand's online reputation, enhances public perception and trust.",Growing,"Marketing, PR",Online Reputation Management Basics
Design Thinking,"Prototyping, User Research, Innovation","Applies design principles to solve complex problems, enhances user-centric innovation.",High Growth,"Tech, Product Design",Design Thinking Basics
Game Development,"Programming, Storytelling, User Experience","Creates engaging video games, enhances entertainment and user interaction.",High Growth,"Entertainment, Tech",Game Development Basics
Blockchain for Supply Chain,"Transparency, Data Integrity, Smart Contracts","Utilizes blockchain technology to enhance supply chain management, improves traceability and trust.",High Growth,"Manufacturing, Logistics",Blockchain for Supply Chain Basics
AI in Marketing,"Data Analysis, Personalization, Consumer Insights",Applies AI techniques to enhance marketing strategies and customer engagement.,High Growth,Marketing,AI in Marketing Basics
Podcasting,"Audio Production, Storytelling, Marketing","Creates and distributes audio content, enhances brand visibility and audience engagement.",Growing,"Media, Marketing",Podcasting Basics
Digital Transformation in Business,"Change Management, Strategy Development, Technology Integration","Guides organizations through digital transformation, enhances competitiveness and efficiency.",High Growth,All industries,Digital Transformation in Business Course
Cloud Application Development,"Programming, Cloud Services, API Management","Develops applications for cloud environments, enhances scalability and accessibility.",High Growth,Tech,Cloud Application Development Basics
Elder Care Management,"Healthcare, Communication, Policy Development","Manages care for elderly populations, enhances quality of life and service delivery.",Growing,Healthcare,Elder Care Management Basics
Digital Security Audits,"Risk Assessment, Compliance, Data Protection","Conducts audits to assess and enhance digital security measures, ensures compliance with standards.",Growing,All industries,Digital Security Audits Basics
Social Entrepreneurship,"Business Development, Community Engagement, Innovation","Develops business models that address social issues, enhances community well-being and sustainability.",Growing,"Nonprofits, Business",Social Entrepreneurship Basics
Augmented Reality Marketing,"User Experience, Digital Marketing, Technology","Uses AR to enhance marketing strategies, creates immersive brand experiences.",High Growth,"Marketing, Tech",Augmented Reality Marketing Basics
Employee Training Needs Assessment,"Evaluation, Communication, Learning Theory","Identifies training requirements within organizations, enhances training effectiveness.",Growing,"HR, All industries",Training Needs Assessment Basics
Digital Content Strategy,"SEO, Analytics, User Engagement","Develops strategies for creating and managing digital content, enhances audience interaction.",Growing,Marketing,Digital Content Strategy Basics
Gamification,"Game Design, User Engagement, Motivation","Applies game elements to non-game contexts, enhances user motivation and engagement.",Growing,"Marketing, Education",Gamification Basics
Data Science for Business,"Predictive Analytics, Data Visualization, Statistical Analysis","Applies data science techniques to inform business decisions, enhances operational strategies.",High Growth,Business,Data Science for Business Basics
Telehealth Technology,"Patient Engagement, Data Security, Healthcare IT","Utilizes technology to enhance remote healthcare delivery, improves patient access and outcomes.",High Growth,Healthcare,Telehealth Technology Basics
Natural Language Processing (NLP),"Machine Learning, Linguistics, AI","Enables machines to understand and interact using human language, enhances user interfaces.",High Growth,"Tech, AI",NLP Basics
Content Distribution,"SEO, Social Media, Email Marketing","Manages the dissemination of content across channels, enhances visibility and audience reach.",Growing,Marketing,Content Distribution Basics
Predictive Analytics,"Data Mining, Statistical Analysis, Machine Learning","Uses historical data to make informed predictions about future trends, enhances decision-making.",High Growth,"Finance, Marketing",Predictive Analytics Course
DevOps Practices,"Continuous Integration, Automation, Agile Methodologies",Combines software development and IT operations to enhance collaboration and efficiency.,High Growth,Tech,DevOps Fundamentals
Augmented Reality in Education,"Educational Technology, User Experience, Content Creation","Utilizes AR to create immersive learning experiences, enhances engagement and understanding.",Growing,Education,AR in Education Basics
IoT Security,"Network Security, Risk Management, Device Management","Protects IoT devices and networks from cyber threats, ensures data privacy and integrity.",High Growth,"Tech, Manufacturing",IoT Security Fundamentals
Data Storytelling,"Data Visualization, Communication, Narrative Techniques","Combines data analysis with storytelling to communicate insights effectively, enhances understanding.",Growing,All industries,Data Storytelling Basics
Customer Experience Management,"User Research, Data Analysis, Communication","Focuses on improving customer interactions and satisfaction, enhances loyalty and retention.",High Growth,"Marketing, Retail",Customer Experience Management Course
Digital Content Creation,"Copywriting, Graphic Design, Video Production","Produces engaging digital content for various platforms, enhances brand visibility and audience engagement.",Growing,"Marketing, Media",Digital Content Creation Basics
Behavioral Data Analysis,"Data Analytics, Psychology, Market Research","Analyzes consumer behavior data to inform marketing strategies, enhances targeting effectiveness.",Growing,"Marketing, Tech",Behavioral Data Analysis Course
Health Informatics,"Data Management, Patient Privacy, Electronic Health Records",Integrates data science into healthcare to improve patient outcomes and operational efficiency.,High Growth,Healthcare,Health Informatics Basics
Cloud Migration,"Data Management, IT Strategy, Security","Facilitates the transition of data and applications to cloud environments, enhances scalability.",High Growth,Tech,Cloud Migration Basics
Digital Asset Management,"File Organization, Metadata Management, Content Distribution","Manages digital assets for easy access and distribution, enhances brand consistency.",Growing,"Media, Marketing",Digital Asset Management Basics
Mobile App Development,"UI/UX Design, Programming, Agile Methodologies","Creates applications for mobile devices, enhances user experience and functionality.",High Growth,Tech,Mobile App Development Course
Crisis Communication,"Public Relations, Media Relations, Stakeholder Engagement","Develops strategies for managing communication during crises, protects brand reputation.",Growing,"PR, Corporate",Crisis Communication Basics
Digital Advertising,"PPC, SEO, Analytics","Implements online advertising strategies to reach target audiences, enhances brand visibility.",High Growth,Marketing,Digital Advertising Basics
Sustainability Reporting,"Data Analysis, Environmental Policy, Corporate Governance","Tracks and reports on sustainability initiatives, enhances transparency and accountability.",Growing,"Corporate, Environment",Sustainability Reporting Basics
Machine Learning for Marketing,"Data Analysis, Predictive Modeling, Customer Insights",Applies ML techniques to enhance marketing strategies and customer engagement.,High Growth,Marketing,ML for Marketing Basics
Blockchain in Healthcare,"Data Security, Patient Privacy, Interoperability",Utilizes blockchain technology to enhance patient data security and interoperability among providers.,High Growth,Healthcare,Blockchain in Healthcare Basics
Talent Acquisition Strategies,"Recruitment, Employer Branding, Interviewing","Develops effective strategies for attracting and retaining talent, enhances organizational success.",Growing,"HR, Corporate",Talent Acquisition Basics
Financial Modeling,"Excel, Data Analysis, Valuation","Creates representations of a company’s financial performance, supports strategic decision-making.",Stable,Finance,Financial Modeling Basics
Social Impact Assessment,"Evaluation, Data Analysis, Community Engagement","Measures the impact of programs on communities, informs funding and policy decisions.",Growing,"Nonprofits, Government",Social Impact Assessment Basics
Digital Learning Tools,"E-Learning, User Experience, Instructional Design","Utilizes technology to enhance learning experiences and accessibility, improves educational outcomes.",High Growth,Education,Digital Learning Tools Basics
Cybersecurity Risk Assessment,"Compliance, Vulnerability Management, Incident Response","Identifies and evaluates potential risks to cybersecurity, informs mitigation strategies.",High Growth,"Tech, Finance",Cybersecurity Risk Assessment Basics
Sales Enablement,"Training, Content Creation, Data Analysis","Equips sales teams with resources and tools to enhance performance, improves customer interactions.",Growing,"Sales, Marketing",Sales Enablement Basics
Corporate Social Responsibility,"Sustainability, Community Engagement, Reporting","Develops initiatives that benefit society, enhances brand reputation and trust.",Growing,"Corporate, Nonprofits",CSR Basics
E-commerce Optimization,"UX Design, SEO, Data Analytics","Enhances online shopping experiences to increase conversion rates, improves customer satisfaction.",High Growth,"Retail, Tech",E-commerce Optimization Basics
Smart Manufacturing,"IoT, Data Analytics, Robotics","Integrates advanced technologies into manufacturing processes, enhances efficiency and productivity.",High Growth,"Manufacturing, Tech",Smart Manufacturing Basics
Video Marketing,"Content Creation, SEO, Social Media","Uses video content to enhance marketing strategies, improves engagement and brand visibility.",Growing,"Marketing, Media",Video Marketing Basics
Data Warehousing,"ETL, SQL, Data Management","Centralizes data storage for easy access and analysis, supports business intelligence initiatives.",Stable,"Tech, Finance",Data Warehousing Basics
User-Centered Design,"UX Research, Prototyping, Usability Testing","Focuses on designing products based on user needs and feedback, enhances user satisfaction.",Growing,"Tech, Design",User-Centered Design Basics
SEO Analytics,"Data Analysis, Keyword Research, Content Optimization","Analyzes SEO performance data to enhance website visibility, supports content strategy.",High Growth,Marketing,SEO Analytics Basics
Digital Twin Technology,"IoT, Simulation, Data Analysis",Creates virtual replicas of physical systems for real-time monitoring and optimization.,High Growth,"Manufacturing, Tech",Digital Twin Technology Basics
Healthcare Policy,"Research, Advocacy, Regulatory Compliance","Develops policies to improve healthcare systems and patient outcomes, supports public health initiatives.",Growing,Healthcare,Healthcare Policy Basics
Culinary Innovation,"Food Science, Recipe Development, Nutrition","Explores new cooking techniques and ingredients, enhances culinary experiences.",Growing,"Food Industry, Hospitality",Culinary Innovation Basics
Retail Analytics,"Data Analysis, Consumer Insights, Inventory Management",Analyzes retail data to optimize inventory and enhance customer experience.,High Growth,Retail,Retail Analytics Basics
Brand Management,"Marketing Strategy, Communication, Market Research","Develops and maintains a brand’s identity and reputation, enhances customer loyalty.",Growing,"Marketing, Corporate",Brand Management Basics
Nonprofit Management,"Fundraising, Program Development, Community Engagement","Oversees operations and initiatives of nonprofit organizations, enhances community impact.",Growing,Nonprofits,Nonprofit Management Basics
Product Lifecycle Management,"Project Management, Data Analysis, User Feedback","Manages a product’s lifecycle from inception to retirement, enhances efficiency and profitability.",Growing,"Manufacturing, Tech",Product Lifecycle Management Basics
Digital Privacy,"Compliance, Data Security, Ethics","Protects personal information and ensures compliance with privacy laws, enhances trust.",Growing,All industries,Digital Privacy Basics
Corporate Governance,"Compliance, Risk Management, Ethical Standards","Establishes frameworks for organizational decision-making, enhances accountability and transparency.",Stable,Corporate,Corporate Governance Basics
Localization,"Translation, Cultural Adaptation, Market Research","Adapts products and content for local markets, enhances customer engagement and satisfaction.",Growing,"Marketing, Tech",Localization Basics
Digital Marketing Strategy,"SEO, Content Marketing, Analytics",Develops comprehensive online marketing strategies to reach target audiences effectively.,High Growth,Marketing,Digital Marketing Strategy Basics
Art and Design,"Visual Communication, Graphic Design, Creative Thinking","Combines artistic skills with design principles to create visual content, enhances communication.",Growing,"Art, Marketing",Art and Design Basics
Event Management,"Project Management, Communication, Budgeting","Plans and executes events, enhances brand visibility and customer engagement.",Growing,"Corporate, Entertainment",Event Management Basics
Advanced Manufacturing Technologies,"Robotics, 3D Printing, AI","Integrates advanced technologies into manufacturing processes, enhances productivity and innovation.",High Growth,Manufacturing,Advanced Manufacturing Basics
Intuitive User Interfaces,"UX Design, Prototyping, User Testing","Designs user interfaces that are easy to navigate, enhances user experience and satisfaction.",Growing,"Tech, Design",Intuitive User Interfaces Basics
Remote Team Management,"Communication, Project Management, Collaboration","Manages and supports distributed teams, enhances productivity and engagement.",Growing,Corporate,Remote Team Management Basics
Digital Transformation,"Change Management, Technology Integration, Strategy Development",Guides organizations through digital changes to enhance operations and competitiveness.,High Growth,All industries,Digital Transformation Basics
Bioinformatics,"Data Analysis, Biology, Programming","Analyzes biological data using computational techniques, enhances research and discovery.",High Growth,"Healthcare, Research",Bioinformatics Basics
Supply Chain Optimization,"Logistics, Data Analysis, Lean Management",Enhances supply chain efficiency through data-driven decision-making and process improvements.,High Growth,"Manufacturing, Retail",Supply Chain Optimization Basics
Gamified Learning,"Game Design, Instructional Design, User Engagement",Applies game mechanics to learning experiences to enhance motivation and retention.,Growing,Education,Gamified Learning Basics
Data Protection,"Compliance, Risk Management, Cybersecurity","Implements measures to safeguard sensitive data, ensures regulatory compliance.",High Growth,All industries,Data Protection Basics
Creative Problem Solving,"Critical Thinking, Team Collaboration, Innovation","Develops innovative solutions to complex challenges, enhances organizational effectiveness.",Growing,All industries,Creative Problem Solving Basics
Remote Learning Facilitation,"E-Learning, Communication, Instructional Design","Guides online learning experiences, enhances engagement and learning outcomes.",High Growth,Education,Remote Learning Facilitation Basics
Personal Finance,"Budgeting, Investment, Financial Planning","Educates individuals on managing their finances effectively, enhances financial literacy.",Growing,"Finance, Education",Personal Finance Basics
Retail Technology,"E-commerce, Data Analytics, Customer Experience",Integrates technology into retail practices to enhance customer experience and operational efficiency.,High Growth,Retail,Retail Technology Basics
Crisis Response Planning,"Risk Management, Communication, Strategic Planning","Develops proactive plans for emergency situations, enhances organizational resilience.",Growing,"Government, Corporate",Crisis Response Planning Basics
Digital Marketing Analytics,"Data Analysis, SEO, PPC",Analyzes digital marketing performance data to optimize strategies and improve ROI.,High Growth,Marketing,Digital Marketing Analytics Basics
Elder Care Technology,"Healthcare IT, Patient Engagement, Communication","Utilizes technology to enhance care and communication for elderly populations, improves quality of life.",Growing,Healthcare,Elder Care Technology Basics
Workforce Diversity,"Inclusion Strategies, Training, Recruitment","Promotes diverse and inclusive workplaces, enhances organizational culture and innovation.",Growing,All industries,Workforce Diversity Basics
Digital Product Management,"Agile Methodologies, UX Design, Market Research","Oversees the development and lifecycle of digital products, enhances user satisfaction and market fit.",High Growth,Tech,Digital Product Management Basics
Innovation Management,"Change Management, Project Management, Strategic Thinking","Guides organizations in fostering and managing innovation, enhances competitive advantage.",Growing,All industries,Innovation Management Basics
Quality Assurance in Software,"Testing, Process Improvement, Agile Methodologies","Ensures software products meet quality standards, enhances reliability and customer satisfaction.",High Growth,Tech,Quality Assurance Basics
Digital Media Production,"Video Editing, Audio Production, Content Creation","Produces high-quality digital media content for various platforms, enhances audience engagement.",Growing,"Media, Marketing",Digital Media Production Basics
Supply Chain Risk Management,"Risk Assessment, Data Analysis, Compliance","Identifies and mitigates risks within supply chains, enhances resilience and efficiency.",Growing,"Manufacturing, Retail",Supply Chain Risk Management Basics
Pharmaceutical Marketing,"Market Research, Regulatory Compliance, Branding","Develops marketing strategies for pharmaceutical products, enhances brand awareness and compliance.",High Growth,Healthcare,Pharmaceutical Marketing Basics
Cultural Intelligence,"Diversity Training, Communication, Global Awareness","Enhances understanding and respect for diverse cultures, supports effective global interactions.",Growing,All industries,Cultural Intelligence Basics
Artificial Intelligence in HR,"Recruitment, Data Analysis, Employee Engagement","Utilizes AI technologies to enhance HR practices, improves recruitment and employee satisfaction.",High Growth,"HR, Corporate",AI in HR Basics
Nonprofit Fundraising Strategies,"Grant Writing, Donor Relations, Event Planning","Develops effective strategies for raising funds, enhances organizational sustainability.",Growing,Nonprofits,Fundraising Strategies Basics
Smart City Planning,"Urban Development, IoT, Data Analysis","Integrates smart technologies into urban planning, enhances livability and sustainability.",High Growth,"Government, Urban Planning",Smart City Planning Basics
3D Printing Technology,"CAD, Prototyping, Manufacturing","Utilizes 3D printing for rapid prototyping and manufacturing, enhances product development efficiency.",High Growth,"Manufacturing, Tech",3D Printing Technology Basics
Gamified Marketing,"User Engagement, Game Design, Analytics","Incorporates gamification into marketing strategies, enhances customer interaction and loyalty.",Growing,Marketing,Gamified Marketing Basics
Emotional Intelligence in Leadership,"Communication, Team Management, Conflict Resolution","Applies emotional intelligence principles in leadership, enhances team collaboration and morale.",Growing,Corporate,Emotional Intelligence Basics
Digital Finance,"Cryptocurrency, Fintech, Investment Strategies","Leverages digital technologies in financial services, enhances accessibility and efficiency.",High Growth,"Finance, Tech",Digital Finance Basics
Online Community Building,"Social Media, Content Creation, Engagement Strategies","Develops and nurtures online communities, enhances brand loyalty and user engagement.",Growing,"Marketing, Community",Online Community Building Basics
Visual Merchandising,"Retail Design, Marketing, Consumer Behavior","Enhances product displays to attract customers, improves shopping experience and sales.",Growing,Retail,Visual Merchandising Basics
Telecommunications Management,"Network Security, Data Management, Customer Service","Oversees telecommunications systems and services, enhances connectivity and user satisfaction.",Stable,Telecommunications,Telecommunications Management Basics
Experiential Marketing,"Event Planning, Brand Strategy, Customer Engagement","Creates immersive brand experiences, enhances consumer connection and loyalty.",High Growth,Marketing,Experiential Marketing Basics
Digital Workflow Automation,"Process Improvement, Software Integration, Data Analysis","Automates business processes using digital tools, enhances efficiency and productivity.",Growing,All industries,Digital Workflow Automation Basics
Healthcare Data Analytics,"Data Visualization, Statistics, Reporting",Analyzes healthcare data to improve patient care and operational efficiency.,High Growth,Healthcare,Healthcare Data Analytics Basics
Biotechnology Innovations,"Research, Development, Regulatory Compliance","Develops new biotechnological products and solutions, enhances healthcare and agricultural outcomes.",High Growth,"Healthcare, Agriculture",Biotechnology Innovations Basics
Sustainable Agriculture,"Environmental Science, Farming Practices, Policy","Promotes practices that enhance agricultural sustainability, improves food security and environmental health.",Growing,Agriculture,Sustainable Agriculture Basics
Digital Skills Training,"E-learning, Curriculum Development, Assessment","Provides training in digital skills for various audiences, enhances employability and workforce readiness.",Growing,"Education, Corporate",Digital Skills Training Basics
