Skill,Related Skills,Explanation,Popularity Trend,Industry Focus,Resources
Health Informatics,"Data Analysis, IT Skills, Patient Management","Manages health information systems, improves patient care through data utilization.",High Growth,Healthcare,Health Informatics Certification
Public Speaking,"Presentation Skills, Communication, Persuasion","Enhances verbal communication and audience engagement, supports effective messaging.",Stable,All industries,Public Speaking Workshop
Corporate Training,"Instructional Design, Employee Development, Facilitation","Develops training programs to enhance employee skills and performance, supports organizational growth.",Growing,All industries,Corporate Training Basics
Crisis Management Planning,"Risk Assessment, Communication, Recovery Strategies","Prepares organizations to handle crises effectively, minimizes impact on operations.",Growing,All industries,Crisis Management Planning Course
3D Printing,"CAD Design, Prototyping, Materials Science","Creates physical objects from digital models, enhances product development and manufacturing.",High Growth,"Manufacturing, Design",3D Printing Fundamentals
Quantitative Research,"Statistical Analysis, Data Collection, Report Writing","Uses numerical data to analyze phenomena, supports evidence-based decision-making.",Growing,"Research, Academia",Quantitative Research Course
Customer Experience Management,"User Feedback, Data Analysis, Service Design",Enhances customer satisfaction and loyalty through improved interactions and experiences.,Growing,All industries,Customer Experience Management Course
Influencer Marketing,"Social Media, Content Creation, Brand Strategy","Leverages influencers to promote products, enhances brand awareness and reach.",High Growth,"Marketing, E-commerce",Influencer Marketing Basics
Microservices Architecture,"API Development, Cloud Computing, Agile Methodologies","Designs scalable and flexible software architectures, enhances system resilience and deployment speed.",Growing,Tech,Microservices Architecture Course
Artificial Intelligence in Education,"Adaptive Learning, Data Analysis, Technology Integration",Utilizes AI to personalize learning experiences and improve educational outcomes.,High Growth,Education,AI in Education Course
Gamification,"Game Design, User Engagement, Behavioral Psychology",Applies game elements to non-game contexts to enhance motivation and engagement.,Growing,"Education, Marketing",Gamification Basics
Smart Grid Technology,"Energy Management, IoT, Data Analysis",Integrates advanced technologies into energy systems for improved efficiency and reliability.,High Growth,"Energy, Utilities",Smart Grid Technology Course
Culinary Nutrition,"Food Science, Health Education, Menu Planning",Combines culinary arts with nutrition science to promote healthy eating habits.,Growing,"Healthcare, Hospitality",Culinary Nutrition Basics
Digital Marketing Analytics,"Data Visualization, SEO, PPC","Analyzes digital marketing performance, supports data-driven decisions for campaign optimization.",Growing,"Marketing, Tech",Digital Marketing Analytics Course
Health & Safety Management,"Risk Assessment, Compliance, Training","Ensures workplace safety and regulatory compliance, promotes health initiatives.",Growing,All industries,Health & Safety Management Course
Online Community Management,"Social Media, Content Creation, Customer Engagement","Builds and nurtures online communities, enhances brand loyalty and customer relationships.",Growing,"Marketing, Tech",Online Community Management Basics
Market Research,"Data Analysis, Survey Design, Consumer Insights",Gathers and analyzes market data to inform business strategies and product development.,Stable,All industries,Market Research Basics
Video Game Development,"Game Design, Programming, Animation","Creates interactive entertainment experiences, enhances storytelling and user engagement.",High Growth,"Entertainment, Tech",Video Game Development Course
Speech-Language Pathology,"Communication Disorders, Therapy Techniques","Assesses and treats speech and language disorders, enhances communication skills.",Growing,Healthcare,Speech-Language Pathology Basics
Digital Supply Chain,"Data Analysis, Blockchain, Logistics","Integrates digital technologies to optimize supply chain processes, enhances visibility and efficiency.",High Growth,"Manufacturing, Retail",Digital Supply Chain Basics
Cognitive Behavioral Therapy (CBT),"Psychological Techniques, Patient Management","Uses evidence-based strategies to treat mental health issues, enhances therapeutic outcomes.",Growing,Healthcare,CBT Basics
Workplace Diversity Training,"Inclusion Strategies, Training Development, Policy Implementation","Promotes diversity and inclusion in the workplace, enhances organizational culture.",Growing,All industries,Workplace Diversity Training Course
Automotive Technology,"Mechanical Engineering, Electronics, Safety Standards","Develops and integrates technology into automotive systems, enhances safety and performance.",High Growth,Automotive,Automotive Technology Basics
Retail Management,"Customer Service, Inventory Control, Sales Strategy","Oversees retail operations, enhances customer satisfaction and sales performance.",Stable,Retail,Retail Management Fundamentals
Blockchain in Healthcare,"Data Security, Interoperability, Patient Management",Utilizes blockchain technology to enhance data security and patient care coordination.,High Growth,Healthcare,Blockchain in Healthcare Course
Geographic Information Systems (GIS),"Spatial Analysis, Cartography, Data Visualization","Analyzes spatial data for decision-making in various fields, enhances understanding of geographic patterns.",Growing,"Environmental Science, Tech",GIS Basics
Nutritional Psychology,"Behavioral Science, Nutrition, Mental Health","Studies the relationship between nutrition and psychological well-being, informs dietary recommendations.",Growing,"Healthcare, Education",Nutritional Psychology Basics
Event Marketing,"Branding, Social Media, Audience Engagement","Develops marketing strategies for events, enhances participation and visibility.",Growing,"Marketing, Events",Event Marketing Course
Emerging Technologies,"Research, Trend Analysis, Strategic Planning",Identifies and assesses the potential impact of new technologies on business and society.,Growing,All industries,Emerging Technologies Course
Digital Ethics,"Data Privacy, AI Ethics, Compliance","Addresses ethical considerations in digital practices, enhances responsible technology use.",Growing,All industries,Digital Ethics Basics
Public Policy Analysis,"Research Methods, Data Interpretation, Advocacy","Evaluates and develops public policies, informs decision-making in governance.",Growing,"Government, Nonprofits",Public Policy Analysis Course
Performance Management,"Goal Setting, Feedback, Employee Development","Manages employee performance to achieve organizational goals, enhances workforce effectiveness.",Stable,All industries,Performance Management Basics
User Interface Design,"Graphic Design, Usability Testing, Interaction Design","Creates visually appealing and functional user interfaces, enhances user experience.",Growing,"Tech, E-commerce",UI Design Fundamentals
Corporate Social Responsibility (CSR),"Ethics, Sustainability, Stakeholder Engagement","Develops and implements CSR initiatives, enhances corporate reputation and community impact.",Growing,All industries,CSR Basics
Health Coaching,"Behavioral Change, Nutrition, Fitness","Guides individuals in achieving health and wellness goals, promotes healthy lifestyle changes.",Growing,Healthcare,Health Coaching Basics
Quantitative Finance,"Statistical Analysis, Risk Management, Financial Modeling","Applies quantitative techniques to financial markets, enhances investment decision-making.",High Growth,Finance,Quantitative Finance Course
User-Centered Design,"Prototyping, User Research, Interaction Design","Focuses on designing products based on user needs and feedback, enhances usability.",Growing,"Tech, Product Design",User-Centered Design Basics
Digital Advertising,"PPC, SEO, Content Marketing",Manages online advertising strategies to reach target audiences effectively.,High Growth,"Marketing, Tech",Digital Advertising Basics
Environmental Sustainability,"Resource Management, Policy Development, Community Engagement","Promotes practices that minimize environmental impact, enhances community well-being.",Growing,"Nonprofits, Government",Environmental Sustainability Course
Retail Technology,"POS Systems, Inventory Management, E-commerce",Integrates technology into retail operations to enhance efficiency and customer experience.,High Growth,Retail,Retail Technology Fundamentals
Social Impact Investing,"Financial Analysis, Impact Measurement, Fundraising","Invests in projects that generate social and environmental benefits, supports positive change.",Growing,"Finance, Nonprofits",Social Impact Investing Basics
Technical Writing,"Documentation, Editing, Communication","Creates clear and concise technical documentation, enhances user understanding of products.",Stable,"Tech, Engineering",Technical Writing Basics
Remote Team Management,"Communication, Collaboration Tools, Leadership","Manages distributed teams effectively, enhances productivity and engagement in remote work.",Growing,All industries,Remote Team Management Course
Digital Transformation Strategy,"Business Strategy, Change Management, Technology Integration","Develops comprehensive plans for digital transformation, enhances organizational agility.",High Growth,All industries,Digital Transformation Strategy Course
Music Production,"Audio Engineering, Composition, Sound Design","Creates and records music, enhances sound quality and artistic expression.",Growing,"Entertainment, Media",Music Production Basics
Disaster Recovery Planning,"Risk Assessment, Business Continuity, Emergency Management","Prepares organizations for recovery after disasters, minimizes operational disruption.",Growing,All industries,Disaster Recovery Planning Basics
Fashion Marketing,"Brand Strategy, Social Media, Trend Analysis","Promotes fashion brands and products, enhances market visibility and consumer engagement.",Growing,"Fashion, Marketing",Fashion Marketing Course
Content Management Systems (CMS),"Web Development, SEO, Digital Strategy","Manages digital content creation and publishing, enhances website functionality and user experience.",Stable,"Tech, Marketing",CMS Basics
Advertising Psychology,"Consumer Behavior, Market Research, Campaign Strategy","Studies the psychological principles behind consumer decision-making, informs advertising strategies.",Growing,"Marketing, Advertising",Advertising Psychology Course
Cybersecurity Awareness Training,"Risk Management, Compliance, Security Protocols","Educates employees on cybersecurity best practices, enhances organizational security posture.",Growing,All industries,Cybersecurity Awareness Basics
B2B Sales,"Relationship Management, Negotiation, Lead Generation","Manages sales processes in business-to-business contexts, enhances customer relationships and revenue.",Growing,"Sales, Marketing",B2B Sales Basics
Blockchain Development,"Smart Contracts, DApps, Cryptography","Develops decentralized applications using blockchain technology, enhances security and transparency.",High Growth,"Tech, Finance",Blockchain Development Course
Digital Photography,"Photo Editing, Composition, Lighting","Captures and edits photographs for various purposes, enhances visual storytelling.",Growing,"Media, Marketing",Digital Photography Basics
Regulatory Compliance,"Risk Management, Policy Development, Auditing","Ensures organizations adhere to laws and regulations, enhances ethical practices and accountability.",Stable,All industries,Regulatory Compliance Basics
Product Management,"Market Research, Roadmapping, Agile Methodologies","Oversees product development and strategy, enhances product-market fit and user satisfaction.",Growing,"Tech, Consumer Goods",Product Management Basics
Customer Insights,"Data Analysis, User Research, Feedback Analysis","Analyzes customer data to understand preferences and behaviors, informs product and marketing strategies.",Growing,"Marketing, Tech",Customer Insights Course
Digital Rights Management,"Copyright Law, Licensing, Technology","Protects digital content through legal frameworks, enhances rights management and monetization.",Growing,"Media, Entertainment",Digital Rights Management Basics
IT Project Management,"Agile Methodologies, Risk Management, Stakeholder Engagement","Manages IT projects effectively, enhances project delivery and resource allocation.",Growing,Tech,IT Project Management Course
User Engagement Strategies,"Analytics, Content Marketing, Social Media","Develops methods to enhance user interaction and retention, supports community building.",Growing,"Marketing, E-commerce",User Engagement Strategies Course
Global Business Strategy,"Market Research, International Trade, Cultural Awareness","Develops strategies for operating in global markets, enhances competitiveness and adaptability.",High Growth,Business,Global Business Strategy Basics
Software Testing,"Quality Assurance, Automation, Debugging","Ensures software functionality and reliability, enhances product quality and user satisfaction.",Growing,Tech,Software Testing Basics
Sales Enablement,"Training, Content Creation, Performance Metrics","Equips sales teams with resources and strategies, enhances sales effectiveness and productivity.",Growing,"Sales, Marketing",Sales Enablement Basics
Crisis Intervention,"Counseling Techniques, Communication, Conflict Resolution","Provides immediate support in crisis situations, enhances emotional well-being.",Growing,"Healthcare, Nonprofits",Crisis Intervention Basics
Digital Asset Strategy,"Content Management, SEO, Analytics","Develops strategies for managing and optimizing digital assets, enhances online presence.",Growing,"Marketing, Tech",Digital Asset Strategy Course
Employee Engagement,"Feedback Mechanisms, Recognition Programs, Leadership","Enhances employee satisfaction and productivity, supports positive workplace culture.",Growing,All industries,Employee Engagement Basics
Event Technology,"AV Setup, Online Platforms, Audience Engagement","Integrates technology into events for enhanced experiences, improves logistics and interaction.",Growing,"Events, Marketing",Event Technology Basics
Behavioral Health Technology,"Telehealth, Data Analysis, Patient Engagement",Utilizes technology to enhance mental health services and patient care accessibility.,High Growth,Healthcare,Behavioral Health Technology Course
Internet of Things (IoT),"Embedded Systems, Networking, Data Analytics","Develops interconnected devices for various applications, enhances data collection and automation.",High Growth,"Tech, Manufacturing",IoT Basics
Digital Twin Technology,"Simulation, Data Analysis, IoT","Creates digital replicas of physical systems for monitoring and optimization, enhances efficiency.",High Growth,"Manufacturing, Tech",Digital Twin Basics
AI-Driven Customer Service,"Chatbots, Data Analysis, User Experience","Leverages AI to enhance customer service interactions, improves efficiency and user satisfaction.",High Growth,"Tech, Customer Service",AI Customer Service Basics
Data Governance,"Data Quality, Compliance, Risk Management","Establishes policies for managing data integrity and security, ensures compliance with regulations.",Growing,"Tech, Finance",Data Governance Basics
Sustainable Agriculture,"Soil Health, Crop Management, Environmental Science","Implements eco-friendly farming practices, enhances food security and environmental health.",Growing,"Agriculture, Environment",Sustainable Agriculture Course
Robotics Process Automation,"Process Mapping, Software Development, AI","Automates repetitive tasks using robotics, enhances operational efficiency.",High Growth,"Tech, Manufacturing",RPA Fundamentals
Financial Analysis,"Data Analysis, Reporting, Risk Assessment",Evaluates financial data to support strategic decision-making and investment planning.,Stable,Finance,Financial Analysis Basics
Content Strategy,"SEO, User Experience, Brand Development","Develops comprehensive plans for content creation and distribution, enhances brand visibility.",Growing,"Marketing, Tech",Content Strategy Basics
Behavioral Economics,"Data Analysis, Market Research, Psychology","Studies how psychological factors influence economic decisions, informs marketing strategies.",Growing,"Finance, Marketing",Behavioral Economics Course
Interactive Design,"User Experience, Graphic Design, Prototyping","Focuses on creating engaging user interfaces, enhances user interaction with products.",Growing,"Tech, E-commerce",Interactive Design Basics
Bioinformatics,"Data Analysis, Programming, Genetics","Applies computational tools to analyze biological data, enhances research in genetics and medicine.",High Growth,"Healthcare, Research",Bioinformatics Basics
Social Impact Measurement,"Data Analysis, Evaluation, Program Development","Measures the effectiveness of social programs, informs funding and policy decisions.",Growing,"Nonprofits, Government",Social Impact Measurement Course
Supply Chain Analytics,"Data Visualization, Risk Management, Logistics",Analyzes supply chain data to optimize operations and reduce costs.,High Growth,"Manufacturing, Retail",Supply Chain Analytics Basics
Agile Coaching,"Scrum, Team Facilitation, Change Management","Guides teams in implementing agile methodologies, enhances collaboration and efficiency.",Growing,"Tech, Project Management",Agile Coaching Basics
Digital Forensics,"Cybersecurity, Data Recovery, Legal Compliance","Investigates cyber incidents to gather evidence, enhances security protocols and legal compliance.",High Growth,"Tech, Law Enforcement",Digital Forensics Basics
User Adoption Strategies,"Change Management, Training, Communication","Develops methods to enhance user acceptance of new technologies, improves training effectiveness.",Growing,"Tech, Education",User Adoption Strategies Course
Telecommunications,"Network Design, Protocols, Wireless Technology","Manages and optimizes communication networks, enhances connectivity and data transfer.",Stable,Telecommunications,Telecommunications Basics
Renewable Energy Technologies,"Solar, Wind, Energy Storage","Develops and implements sustainable energy solutions, enhances energy efficiency and sustainability.",High Growth,"Energy, Environment",Renewable Energy Technologies Course
Artificial Intelligence in Finance,"Predictive Modeling, Data Analysis, Risk Assessment",Applies AI techniques to enhance financial decision-making and risk management.,High Growth,Finance,AI in Finance Basics
E-Learning Development,"Instructional Design, Technology Integration, Content Creation","Creates online educational programs, enhances accessibility and engagement in learning.",Growing,Education,E-Learning Development Course
Market Segmentation,"Data Analysis, Consumer Insights, Strategy Development","Divides markets into distinct segments to tailor marketing strategies, enhances targeting effectiveness.",Growing,Marketing,Market Segmentation Basics
Cloud Security,"Data Encryption, Network Security, Compliance","Protects cloud-based data and applications from threats, ensures regulatory compliance.",High Growth,"Tech, Finance",Cloud Security Basics
User Research,"Qualitative Methods, Data Analysis, Usability Testing","Conducts studies to understand user needs and behaviors, informs product development.",Growing,"Tech, Design",User Research Basics
Digital Identity Management,"Access Control, Authentication, Security Protocols","Manages user identities and access to systems, enhances security and compliance.",Growing,"Tech, Finance",Digital Identity Management Basics
Predictive Maintenance,"Data Analytics, IoT, Reliability Engineering","Uses data analysis to predict equipment failures, enhances operational efficiency and uptime.",High Growth,"Manufacturing, Tech",Predictive Maintenance Course
Digital Ethics in AI,"Bias Mitigation, Transparency, Accountability","Addresses ethical issues related to AI deployment, promotes responsible use of technology.",High Growth,"Tech, Policy",Digital Ethics in AI Course
Smart City Technologies,"IoT, Data Analytics, Urban Planning","Integrates advanced technologies into urban infrastructure, enhances city management and sustainability.",High Growth,Urban Development,Smart City Technologies Course
Insurance Technology (InsurTech),"Data Analytics, Risk Assessment, Customer Experience","Innovates the insurance industry through technology, enhances service delivery and risk management.",High Growth,"Finance, Insurance",InsurTech Basics
Creative Coding,"Programming, Digital Art, Interaction Design","Combines coding and creativity to produce interactive digital experiences, enhances artistic expression.",Growing,"Art, Tech",Creative Coding Course
Environmental Policy,"Research, Advocacy, Regulatory Compliance","Develops and evaluates policies to address environmental issues, promotes sustainability.",Growing,"Government, Nonprofits",Environmental Policy Basics
Healthcare Analytics,"Data Analysis, Predictive Modeling, Patient Outcomes","Analyzes health data to improve patient care and operational efficiency, enhances healthcare delivery.",High Growth,Healthcare,Healthcare Analytics Course
Web Development,"HTML, CSS, JavaScript, UX Design","Creates and maintains websites, enhances user experience and functionality.",Stable,Tech,Web Development Basics
Organizational Development,"Change Management, Leadership Development, Training","Enhances organizational effectiveness through strategic initiatives, supports workforce development.",Growing,All industries,Organizational Development Basics
Social Media Management,"Content Creation, Analytics, Community Engagement","Manages brand presence on social platforms, enhances audience interaction and engagement.",High Growth,Marketing,Social Media Management Course
Machine Learning Operations (MLOps),"DevOps, Model Deployment, Monitoring","Applies DevOps principles to machine learning models, enhances model performance and reliability.",High Growth,Tech,MLOps Fundamentals
Customer Relationship Management (CRM),"Data Management, Communication, Analytics","Manages customer interactions and data throughout the lifecycle, enhances customer satisfaction.",Stable,"Sales, Marketing",CRM Basics
Data Privacy,"Compliance, Risk Management, Legal Regulations","Protects personal data from misuse, ensures compliance with privacy laws and regulations.",Growing,All industries,Data Privacy Basics
Performance Marketing,"Data Analytics, SEO, PPC","Focuses on measurable results in marketing efforts, enhances ROI on campaigns.",High Growth,Marketing,Performance Marketing Course
Digital Nomadism,"Remote Work, Travel, Work-Life Balance","Embraces remote work and travel, enhances work-life integration and flexibility.",Growing,All industries,Digital Nomadism Basics
Fashion Technology,"Wearable Tech, E-commerce, Design","Integrates technology into fashion, enhances design processes and consumer engagement.",High Growth,"Fashion, Tech",Fashion Technology Course
Remote Collaboration Tools,"Communication, Project Management, Cloud Computing","Utilizes tools to enhance collaboration among remote teams, supports productivity.",Growing,All industries,Remote Collaboration Tools Course
Talent Management,"Performance Reviews, Development Plans, Succession Planning","Manages employee talent through recruitment and development strategies, enhances organizational success.",Growing,"HR, All industries",Talent Management Basics
Geospatial Intelligence,"GIS, Remote Sensing, Data Analysis","Analyzes geospatial data for decision-making in various applications, enhances spatial understanding.",Growing,"Defense, Environment",Geospatial Intelligence Basics
Augmented Reality Development,"3D Modeling, Programming, User Experience","Creates AR applications for various industries, enhances user engagement through immersive experiences.",High Growth,"Tech, Gaming",Augmented Reality Development Course
Digital Learning Platforms,"E-Learning, User Experience, Instructional Design","Develops platforms for online education, enhances access to learning resources.",Growing,Education,Digital Learning Platforms Basics
Sports Analytics,"Data Analysis, Performance Metrics, Strategy Development","Analyzes sports performance data, enhances coaching and team strategies.",Growing,Sports,Sports Analytics Basics
Creative Writing,"Storytelling, Editing, Content Creation","Crafts engaging narratives for various mediums, enhances communication and expression.",Stable,"Publishing, Marketing",Creative Writing Basics
Disaster Response,"Emergency Management, Risk Assessment, Communication","Prepares for and responds to emergencies, enhances community resilience.",Growing,"Government, Nonprofits",Disaster Response Basics
Health Data Management,"Electronic Health Records, Data Privacy, Compliance","Manages and protects patient health data, ensures compliance with healthcare regulations.",High Growth,Healthcare,Health Data Management Basics
Virtual Reality Development,"3D Modeling, Game Design, Programming","Creates immersive VR experiences for various applications, enhances user engagement and training.",High Growth,"Tech, Gaming",Virtual Reality Development Basics
Personal Branding,"Digital Marketing, Networking, Communication","Develops a unique personal brand to enhance professional visibility, supports career growth.",Growing,All industries,Personal Branding Basics
