Skill,Related Skills,Explanation,Popularity Trend,Industry Focus,Resources
Social Innovation,"Community Engagement, Design Thinking, Entrepreneurship","Develops innovative solutions to social challenges, enhances community impact.",Growing,"Nonprofits, Corporate",Social Innovation Basics
Digital Transformation for SMEs,"Change Management, Technology Integration, Strategy","Guides small and medium enterprises through digital transformation initiatives, enhances competitiveness.",High Growth,Small Business,Digital Transformation for SMEs Basics
Tech-Enabled Services,"Data Analysis, Software Development, User Experience",Develops services that leverage technology to enhance customer experiences and operational efficiency.,High Growth,"Tech, Services",Tech-Enabled Services Basics
Advanced Marketing Analytics,"Data Science, Predictive Analytics, Campaign Management",Utilizes advanced analytical techniques to optimize marketing campaigns and strategies.,High Growth,Marketing,Advanced Marketing Analytics Basics
AI in Supply Chain Management,"Data Analysis, Machine Learning, Logistics",Applies AI technologies to enhance supply chain efficiency and decision-making.,High Growth,"Manufacturing, Retail",AI in Supply Chain Management Basics
Financial Literacy Education,"Teaching, Community Engagement, Curriculum Development",Develops educational programs to improve financial literacy among individuals and communities.,Growing,"Education, Nonprofits",Financial Literacy Education Basics
Digital Ethics,"Compliance, Policy Development, Social Responsibility","Addresses ethical issues in digital practices, promotes responsible technology use.",Growing,"Tech, Corporate",Digital Ethics Basics
Advanced Manufacturing Techniques,"Engineering, Process Improvement, Automation",Implements innovative manufacturing techniques to enhance productivity and efficiency.,High Growth,Manufacturing,Advanced Manufacturing Basics
Employee Advocacy Programs,"HR, Communication, Team Building","Develops programs to promote employee rights and engagement, enhances workplace culture.",Growing,Corporate,Employee Advocacy Basics
Smart Home Technology,"IoT, Home Automation, User Experience","Designs and implements technologies for home automation, enhances user convenience and efficiency.",High Growth,"Tech, Consumer Goods",Smart Home Technology Basics
Data-Driven Decision Making,"Analytics, Business Intelligence, Strategy","Utilizes data analytics to inform strategic decision-making, enhances business outcomes.",High Growth,All industries,Data-Driven Decision Making Basics
Digital Skills Training,"E-Learning, Curriculum Development, Instructional Design","Provides training to enhance digital skills among employees and learners, improves employability.",Growing,"Education, Corporate",Digital Skills Training Basics
Customer Insights Analysis,"Data Analysis, Market Research, UX Design",Analyzes customer data to derive insights for product development and marketing strategies.,High Growth,"Marketing, Tech",Customer Insights Analysis Basics
Adaptive Learning Technologies,"E-Learning, Data Analytics, Curriculum Development",Utilizes technology to personalize learning experiences based on individual needs and progress.,High Growth,Education,Adaptive Learning Basics
Technical SEO,"Digital Marketing, Content Optimization, Analytics","Optimizes websites for search engines, enhances visibility and traffic.",Growing,Marketing,Technical SEO Basics
Mobile Security,"Cybersecurity, Risk Assessment, Compliance","Protects mobile devices and applications from security threats, enhances data integrity.",High Growth,"Tech, Finance",Mobile Security Basics
Inclusive Design,"UX/UI Design, Accessibility, User Research","Creates products and services that are accessible to all users, enhances user experience.",Growing,"Tech, Design",Inclusive Design Basics
Digital Communication Skills,"Writing, Presentation, Social Media","Enhances communication skills for effective digital interactions, improves engagement.",Growing,All industries,Digital Communication Skills Basics
Cybersecurity Frameworks,"Risk Management, Compliance, Policy Development","Implements frameworks to guide cybersecurity practices, enhances organizational security.",High Growth,"Tech, Corporate",Cybersecurity Frameworks Basics
Blockchain in Supply Chain,"Logistics, Data Security, Technology Integration",Utilizes blockchain technology to enhance transparency and efficiency in supply chains.,High Growth,"Manufacturing, Logistics",Blockchain in Supply Chain Basics
Freelance Business Management,"Marketing, Finance, Networking","Develops skills to manage a freelance business effectively, enhances income opportunities.",Growing,Creative Industries,Freelance Business Management Basics
Gamification in Marketing,"Game Design, User Engagement, Analytics",Applies gamification techniques to marketing strategies to enhance customer engagement.,High Growth,Marketing,Gamification in Marketing Basics
AI-Powered Customer Support,"Machine Learning, User Experience, Data Analysis","Utilizes AI technologies to enhance customer support services, improves response times and satisfaction.",High Growth,"Tech, Customer Service",AI-Powered Customer Support Basics
Geographic Information Systems (GIS),"Data Analysis, Cartography, Remote Sensing","Uses GIS technology to analyze spatial data, enhances decision-making and planning.",Growing,"Environment, Urban Planning",GIS Basics
Cultural Sensitivity Training,"Diversity, Communication, Team Building","Enhances understanding of cultural differences in the workplace, promotes inclusivity.",Growing,Corporate,Cultural Sensitivity Training Basics
Data-Driven Marketing Strategies,"Data Analysis, SEO, Social Media","Develops marketing strategies based on data insights, enhances targeting and effectiveness.",High Growth,Marketing,Data-Driven Marketing Basics
Online Community Management,"Social Media, Engagement, Content Creation",Manages online communities to enhance engagement and build brand loyalty.,Growing,"Marketing, Tech",Online Community Management Basics
Cybersecurity Incident Response,"Risk Management, Compliance, Communication","Develops strategies for responding to cybersecurity incidents, minimizes damage and recovery time.",High Growth,"Tech, Corporate",Cybersecurity Incident Response Basics
Product Lifecycle Management,"Project Management, Engineering, Quality Assurance","Manages a product's lifecycle from inception to retirement, enhances efficiency and quality.",Growing,"Manufacturing, Tech",Product Lifecycle Management Basics
Virtual Reality for Marketing,"UX Design, Content Creation, Customer Engagement","Utilizes VR technology to create immersive marketing experiences, enhances brand interaction.",High Growth,"Marketing, Tech",Virtual Reality for Marketing Basics
AI in Human Resources,"Data Analysis, Recruitment, Employee Engagement","Applies AI technologies to streamline HR processes, enhances recruitment and employee satisfaction.",High Growth,Corporate,AI in Human Resources Basics
Sustainability Reporting,"Data Analysis, Compliance, Corporate Social Responsibility","Develops reports on sustainability efforts, enhances transparency and accountability.",Growing,"Corporate, Government",Sustainability Reporting Basics
Supply Chain Risk Management,"Data Analysis, Compliance, Logistics","Identifies and mitigates risks within supply chains, enhances resilience and efficiency.",High Growth,"Manufacturing, Logistics",Supply Chain Risk Management Basics
Digital Experience Design,"UX/UI Design, User Research, Content Strategy","Designs digital experiences that enhance user engagement and satisfaction, improves interaction.",Growing,"Tech, Marketing",Digital Experience Design Basics
Digital Sales Techniques,"E-Commerce, CRM, Marketing",Utilizes digital tools and techniques to enhance sales performance and customer engagement.,High Growth,"Retail, Tech",Digital Sales Techniques Basics
Data-Driven Product Development,"Market Research, Analytics, User Feedback","Utilizes data insights to guide product development processes, enhances market fit.",High Growth,"Tech, Consumer Goods",Data-Driven Product Development Basics
Corporate Reputation Management,"Public Relations, Communication, Crisis Management","Develops strategies to enhance and protect corporate reputation, improves stakeholder trust.",Growing,Corporate,Corporate Reputation Management Basics
Digital Accessibility,"UX Design, Compliance, Inclusive Design","Ensures digital products are accessible to all users, enhances inclusivity and user experience.",Growing,"Tech, Education",Digital Accessibility Basics
Emerging Technologies Research,"Data Analysis, Innovation, Technology Trends",Conducts research on emerging technologies to inform strategic decisions and innovation.,High Growth,"Tech, Academia",Emerging Technologies Research Basics
Organizational Development,"Change Management, Leadership, Team Building","Promotes organizational effectiveness through development initiatives, enhances performance.",Growing,Corporate,Organizational Development Basics
Customer Satisfaction Analysis,"Data Analysis, Feedback, Market Research","Analyzes customer feedback to identify areas for improvement, enhances service quality.",Growing,All industries,Customer Satisfaction Analysis Basics
IT Governance,"Compliance, Risk Management, IT Strategy","Implements frameworks to govern IT practices, enhances compliance and strategic alignment.",High Growth,Corporate,IT Governance Basics
Digital Content Strategy,"Content Creation, SEO, User Engagement","Develops strategies for creating and managing digital content, enhances brand presence.",High Growth,Marketing,Digital Content Strategy Basics
Personal Branding,"Marketing, Social Media, Communication",Develops strategies for individuals to build and promote their personal brands effectively.,Growing,All industries,Personal Branding Basics
Data Stewardship,"Data Governance, Compliance, Data Quality","Manages data assets to ensure quality and compliance, enhances decision-making capabilities.",Growing,All industries,Data Stewardship Basics
Augmented Analytics,"Data Science, AI, Business Intelligence","Utilizes AI to enhance data analytics processes, improves insights and decision-making.",High Growth,"Tech, Finance",Augmented Analytics Basics
Cyber Risk Assessment,"Compliance, Data Analysis, Security","Evaluates organizational cyber risks, informs risk management strategies.",High Growth,"Tech, Corporate",Cyber Risk Assessment Basics
Data Architecture,"Database Management, Data Modeling, Cloud Computing","Designs data structures and systems for efficient data management, enhances data accessibility.",High Growth,"Tech, Finance",Data Architecture Basics
Public Health Policy,"Research, Data Analysis, Regulatory Compliance","Develops and evaluates public health policies, informs decision-making in healthcare.",Growing,Healthcare,Public Health Policy Basics
Digital User Experience,"UX Design, User Research, Testing","Enhances digital products through user-centered design processes, improves usability.",Growing,"Tech, E-commerce",Digital User Experience Basics
Advanced Digital Marketing,"SEO, PPC, Content Marketing, Analytics","Develops advanced strategies for digital marketing campaigns, enhances targeting and ROI.",High Growth,Marketing,Advanced Digital Marketing Basics
Blockchain in Healthcare,"Data Security, Compliance, Technology Integration",Utilizes blockchain technology to enhance data security and integrity in healthcare systems.,High Growth,Healthcare,Blockchain in Healthcare Basics
Digital Brand Management,"Social Media, Content Strategy, Analytics","Manages and promotes brand presence in digital environments, enhances customer engagement.",Growing,Marketing,Digital Brand Management Basics
Crisis Management Planning,"Risk Assessment, Communication, Strategy","Develops comprehensive plans for managing crises effectively, protects organizational reputation.",High Growth,Corporate,Crisis Management Planning Basics
Smart Cities Technology,"IoT, Data Analysis, Urban Planning","Implements technology solutions for urban environments, enhances quality of life and efficiency.",High Growth,"Urban Planning, Tech",Smart Cities Technology Basics
Digital Supply Chain Management,"Logistics, Data Analysis, Automation",Utilizes digital tools to enhance supply chain efficiency and transparency.,High Growth,"Manufacturing, Retail",Digital Supply Chain Management Basics
Organizational Change Leadership,"Leadership, Change Management, Communication","Guides organizations through change initiatives, enhances employee buy-in and engagement.",Growing,Corporate,Organizational Change Leadership Basics
Performance Marketing,"SEO, PPC, Data Analysis, Content Creation",Develops marketing strategies focused on measurable outcomes and performance.,High Growth,Marketing,Performance Marketing Basics
Tech Entrepreneurship,"Business Development, Innovation, Marketing","Guides the development of tech-based startups, enhances innovation and market fit.",High Growth,"Startups, Tech",Tech Entrepreneurship Basics
Digital Health Technologies,"Data Analysis, UX Design, Health IT",Develops technologies for enhancing healthcare delivery and patient engagement.,High Growth,Healthcare,Digital Health Technologies Basics
Workforce Development,"Training, HR, Community Engagement","Develops initiatives to enhance workforce skills and employability, improves community impact.",Growing,"Nonprofits, Corporate",Workforce Development Basics
Digital Compliance,"Regulatory Knowledge, Risk Management, Data Protection","Ensures digital practices adhere to regulations and standards, enhances organizational compliance.",Growing,All industries,Digital Compliance Basics
Emerging Market Strategies,"Market Research, Business Development, International Relations","Develops strategies for entering and competing in emerging markets, enhances global presence.",Growing,Corporate,Emerging Market Strategies Basics
Cybersecurity Training,"Risk Management, Compliance, Technical Skills",Provides training programs to enhance cybersecurity awareness and skills among employees.,Growing,Corporate,Cybersecurity Training Basics
Digital Leadership,"Change Management, Strategy, Communication","Develops leadership skills to navigate digital transformations, enhances organizational effectiveness.",High Growth,Corporate,Digital Leadership Basics
Collaborative Project Management,"Team Building, Communication, Agile Methodologies","Manages projects through collaboration and teamwork, enhances project outcomes.",Growing,All industries,Collaborative Project Management Basics
Data-Driven Decision Support,"Data Analysis, Business Intelligence, Reporting","Develops systems to support data-driven decision-making processes, enhances business intelligence.",High Growth,All industries,Data-Driven Decision Support Basics
Digital Fundraising,"Social Media, Marketing, Community Engagement","Develops online strategies for fundraising initiatives, enhances donor engagement.",Growing,Nonprofits,Digital Fundraising Basics
Corporate Innovation Strategy,"Design Thinking, Market Research, Technology Integration","Develops strategies to foster innovation within organizations, enhances competitiveness.",High Growth,Corporate,Corporate Innovation Strategy Basics
Predictive Maintenance,"IoT, Data Analysis, Engineering","Utilizes data analytics to predict maintenance needs, enhances equipment reliability and efficiency.",High Growth,"Manufacturing, Tech",Predictive Maintenance Basics
Cultural Change Initiatives,"Change Management, Team Building, Communication","Develops initiatives to promote cultural change within organizations, enhances employee engagement.",Growing,Corporate,Cultural Change Initiatives Basics
AI in Marketing,"Machine Learning, Data Analysis, Content Creation",Applies AI technologies to enhance marketing strategies and customer engagement.,High Growth,Marketing,AI in Marketing Basics
Mobile Payment Solutions,"FinTech, User Experience, Security","Develops secure mobile payment applications, enhances user convenience and security.",High Growth,"Finance, Tech",Mobile Payment Solutions Basics
Digital Advertising Analytics,"Data Analysis, Marketing, Campaign Management",Analyzes data from digital advertising campaigns to optimize performance and ROI.,High Growth,Marketing,Digital Advertising Analytics Basics
Strategic Communication,"Public Relations, Marketing, Stakeholder Engagement","Develops strategies for effective communication with stakeholders, enhances brand reputation.",Growing,Corporate,Strategic Communication Basics
AI Ethics,"Compliance, Policy Development, Social Responsibility","Addresses ethical considerations in AI development and implementation, promotes responsible use.",Growing,"Tech, Corporate",AI Ethics Basics
Corporate Governance,"Compliance, Risk Management, Stakeholder Engagement","Implements frameworks to ensure effective governance practices, enhances organizational accountability.",High Growth,Corporate,Corporate Governance Basics
Digital Marketing Metrics,"Data Analysis, SEO, PPC","Analyzes marketing metrics to evaluate campaign effectiveness, informs strategy adjustments.",Growing,Marketing,Digital Marketing Metrics Basics
Organizational Effectiveness,"Change Management, Team Development, Performance Management",Enhances organizational performance through effective practices and strategies.,Growing,Corporate,Organizational Effectiveness Basics
Crisis Recovery Strategies,"Risk Management, Communication, Planning","Develops strategies for organizational recovery post-crisis, enhances resilience.",High Growth,Corporate,Crisis Recovery Strategies Basics
Smart Contracts,"Blockchain, Legal Knowledge, Technology","Develops self-executing contracts on blockchain platforms, enhances security and efficiency.",High Growth,"Tech, Finance",Smart Contracts Basics
Digital Project Management Tools,"Software Development, Collaboration, Agile Methodologies","Implements tools to enhance project management and collaboration, improves project outcomes.",High Growth,All industries,Digital Project Management Tools Basics
Behavioral Marketing,"Data Analysis, User Experience, Psychology","Utilizes behavioral data to inform marketing strategies, enhances targeting and personalization.",High Growth,Marketing,Behavioral Marketing Basics
Organizational Psychology in Business,"HR, Leadership, Employee Engagement",Applies principles of psychology to enhance organizational effectiveness and employee satisfaction.,Growing,Corporate,Organizational Psychology Basics
Cross-Cultural Communication,"Communication, Team Building, Cultural Awareness","Enhances communication across cultural boundaries, promotes effective teamwork.",Growing,Corporate,Cross-Cultural Communication Basics
Social Media Analytics,"Data Analysis, Marketing, User Engagement","Analyzes social media data to inform marketing strategies, enhances brand presence.",High Growth,Marketing,Social Media Analytics Basics
Remote Work Best Practices,"Communication, Team Building, Technology","Develops best practices for remote work, enhances productivity and employee satisfaction.",Growing,Corporate,Remote Work Best Practices Basics
Strategic Supply Chain Management,"Logistics, Data Analysis, Risk Management","Develops strategies for efficient and effective supply chain management, enhances operational performance.",High Growth,"Manufacturing, Logistics",Strategic Supply Chain Management Basics
Health and Wellness Programs,"Employee Engagement, HR, Training","Develops programs to promote health and wellness among employees, enhances workplace culture.",Growing,Corporate,Health and Wellness Programs Basics
Customer Journey Mapping,"UX Design, Market Research, Data Analysis",Analyzes and maps customer journeys to enhance user experience and satisfaction.,High Growth,"Marketing, Tech",Customer Journey Mapping Basics
Resilience Training,"Team Building, Training, Leadership","Develops training programs to enhance resilience among employees, improves adaptability and performance.",Growing,Corporate,Resilience Training Basics
Employee Engagement Strategies,"HR, Communication, Team Building","Develops strategies to enhance employee engagement and satisfaction, improves workplace culture.",Growing,Corporate,Employee Engagement Strategies Basics
AI in Education,"Machine Learning, Curriculum Development, Instructional Design",Utilizes AI to enhance educational practices and personalize learning experiences.,High Growth,Education,AI in Education Basics
Digital Risk Management,"Risk Assessment, Compliance, Security","Identifies and mitigates digital risks, enhances organizational resilience.",High Growth,Corporate,Digital Risk Management Basics
Innovation in Financial Services,"FinTech, Market Research, Customer Engagement","Develops innovative solutions for financial services, enhances customer experience and satisfaction.",High Growth,"Finance, Tech",Innovation in Financial Services Basics
Customer Retention Strategies,"Marketing, Customer Engagement, Data Analysis","Develops strategies to enhance customer retention and loyalty, improves long-term profitability.",Growing,Marketing,Customer Retention Strategies Basics
AI-Driven Business Intelligence,"Data Analysis, AI, Strategic Decision Making","Utilizes AI to enhance business intelligence processes, improves insights and decision-making capabilities.",High Growth,All industries,AI-Driven Business Intelligence Basics
Digital Risk Assessment,"Compliance, Risk Management, Data Protection","Evaluates digital practices for risks, informs risk mitigation strategies.",High Growth,Corporate,Digital Risk Assessment Basics
Product Management Fundamentals,"Product Development, Marketing, User Research","Develops foundational skills in product management, enhances product success.",Growing,"Tech, Consumer Goods",Product Management Fundamentals Basics
Cloud Security,"Cybersecurity, Compliance, Risk Management","Ensures security of cloud-based systems and data, enhances organizational protection.",High Growth,"Tech, Corporate",Cloud Security Basics
Mobile UX Design,"UX Design, User Research, Prototyping","Designs user-friendly mobile applications, enhances user satisfaction and engagement.",High Growth,"Tech, E-commerce",Mobile UX Design Basics
Diversity and Inclusion Strategies,"HR, Communication, Team Building","Develops strategies to promote diversity and inclusion within organizations, enhances workplace culture.",Growing,Corporate,Diversity and Inclusion Strategies Basics
Digital Content Creation,"Writing, Multimedia, SEO",Develops engaging digital content to enhance brand presence and user engagement.,High Growth,Marketing,Digital Content Creation Basics
Remote Team Collaboration Tools,"Technology, Communication, Project Management","Implements tools to enhance collaboration among remote teams, improves project outcomes.",High Growth,"Tech, Corporate",Remote Team Collaboration Tools Basics
Healthcare Data Analytics,"Data Analysis, Compliance, Health IT",Analyzes healthcare data to inform decision-making and improve patient care.,High Growth,Healthcare,Healthcare Data Analytics Basics
Social Media Management,"Content Creation, Engagement, Analytics",Manages social media channels to enhance brand presence and engagement.,Growing,Marketing,Social Media Management Basics
Customer Feedback Analysis,"Data Analysis, User Research, Market Research","Analyzes customer feedback to inform product and service improvements, enhances customer satisfaction.",Growing,All industries,Customer Feedback Analysis Basics
Financial Technology Innovations,"FinTech, Data Analysis, Market Research",Develops innovative financial technologies to enhance user experience and operational efficiency.,High Growth,"Finance, Tech",Financial Technology Innovations Basics
Digital Advertising Strategies,"SEO, PPC, Content Marketing, Data Analysis","Develops strategies for effective digital advertising campaigns, enhances targeting and ROI.",High Growth,Marketing,Digital Advertising Strategies Basics
Organizational Assessment,"Data Analysis, HR, Performance Management","Conducts assessments to evaluate organizational effectiveness, informs improvement strategies.",Growing,Corporate,Organizational Assessment Basics
Human-Centered Design,"UX Design, Research, Prototyping",Applies human-centered design principles to create effective and user-friendly products.,High Growth,"Tech, Design",Human-Centered Design Basics
Financial Risk Management,"Compliance, Risk Assessment, Data Analysis","Develops strategies to manage financial risks, enhances organizational stability and compliance.",High Growth,"Finance, Corporate",Financial Risk Management Basics
E-Commerce Best Practices,"Marketing, User Experience, Logistics","Develops strategies for successful e-commerce operations, enhances customer experience and sales.",High Growth,"Retail, Tech",E-Commerce Best Practices Basics
Customer Experience Design,"UX Design, User Research, Customer Engagement",Enhances customer experiences through effective design processes and user feedback.,High Growth,"Marketing, Tech",Customer Experience Design Basics
Social Impact Measurement,"Data Analysis, Evaluation, Reporting","Measures and reports on the social impact of initiatives, enhances accountability and transparency.",Growing,"Nonprofits, Corporate",Social Impact Measurement Basics
Change Management Strategies,"Leadership, Communication, Project Management","Develops strategies to guide organizations through change, enhances employee engagement and buy-in.",High Growth,Corporate,Change Management Strategies Basics
