Skill,Related Skills,Explanation,Popularity Trend,Industry Focus,Resources
Cloud Computing,"DevOps, Virtualization, Kubernetes, Microservices","Enables on-demand resource availability, enhances scalability, supports deployment automation.",High Growth,"Tech, Finance",AWS Certified Solutions Architect
Blockchain,"Smart Contracts, Cryptography, Decentralized Applications","Provides secure, transparent transactions, enables trustless interactions, and supports decentralized systems.",Growing,"Finance, Tech",Blockchain Basics
DevOps,"Continuous Integration, Continuous Delivery, Infrastructure as Code","Enhances collaboration between development and operations, improves deployment frequency.",High Growth,Tech,DevOps Fundamentals
Business Analysis,"Requirements Gathering, Process Modeling, Stakeholder Engagement","Analyzes business needs, facilitates communication between stakeholders, and improves processes.",Growing,All industries,Business Analysis Certification
Mobile Development,"iOS Development, Android Development, Cross-Platform Development","Creates applications for mobile devices, ensures usability and performance on various platforms.",High Growth,"Tech, E-commerce",Mobile App Development
Network Administration,"Routing, Switching, Network Configuration, Firewall Management","Manages and maintains networks, ensures security and optimal performance of network resources.",Stable,"Tech, Education",Network+ Certification
Content Strategy,"Content Creation, SEO, User Research, Analytics","Develops effective content plans, aligns content with business goals, enhances user engagement.",Growing,"Marketing, Tech",Content Strategy Basics
Salesforce,"CRM Management, Data Analytics, Marketing Automation","Manages customer relationships, analyzes sales data, automates marketing efforts.",High Growth,"Tech, Finance",Salesforce Admin Certification
Internet of Things (IoT),"Embedded Systems, Data Analytics, Cloud Computing","Connects devices to the internet, enables data collection and automation for smarter operations.",High Growth,"Tech, Manufacturing",IoT Fundamentals
AR/VR Development,"3D Modeling, Game Development, User Experience Design","Creates immersive experiences, enhances training, and entertainment applications through augmented and virtual reality.",Growing,"Gaming, Education",AR/VR Development Basics
Graphic Design,"Branding, Layout Design, Typography, Digital Illustration","Creates visual content for various media, enhances brand identity and user engagement.",Stable,"Marketing, E-commerce",Graphic Design Basics
Ethical Hacking,"Penetration Testing, Vulnerability Assessment, Security Auditing","Identifies security weaknesses in systems, helps organizations protect against cyber threats.",High Growth,"Tech, Finance",Certified Ethical Hacker (CEH)
SEO,"Keyword Research, On-page Optimization, Link Building","Improves website visibility on search engines, drives organic traffic, enhances online presence.",High Growth,"E-commerce, Marketing",SEO Fundamentals
Video Production,"Editing, Storyboarding, Animation, Sound Design","Creates engaging video content, enhances storytelling through visuals and sound.",Growing,"Media, Marketing",Video Production Basics
Technical Writing,"Documentation, User Manuals, Editing","Communicates complex information clearly, supports product usability and understanding.",Stable,"Tech, Education",Technical Writing Certification
Social Media Management,"Content Creation, Analytics, Customer Engagement","Manages online presence, engages audiences, and analyzes social media performance.",Growing,"Marketing, Tech",Social Media Marketing Course
Remote Sensing,"Geographic Information Systems (GIS), Data Analysis","Collects and analyzes data from satellites, supports environmental monitoring and urban planning.",Growing,"Environmental Science, Tech",Remote Sensing Basics
Game Development,"Game Design, Programming, 3D Modeling","Creates interactive entertainment experiences, combines art and technology.",High Growth,"Entertainment, Tech",Game Development Fundamentals
Product Management,"Market Research, Agile Methodologies, User Testing","Guides product development, prioritizes features based on user feedback and market trends.",Growing,"Tech, E-commerce",Product Management Certification
Artificial Intelligence,"Neural Networks, Natural Language Processing, Robotics","Develops systems that can learn and make decisions, enhances automation and predictive analytics.",High Growth,"Tech, Healthcare",AI Fundamentals
Web Development,"Frontend Development, Backend Development, Responsive Design","Builds and maintains websites, ensures functionality and user experience across devices.",High Growth,"Tech, E-commerce",Web Development Bootcamp
HR Analytics,"Data Visualization, Statistical Analysis, Employee Engagement","Uses data to improve HR decisions, enhances workforce planning, and measures employee satisfaction.",Growing,All industries,HR Analytics Certification
Financial Analysis,"Budgeting, Forecasting, Risk Assessment","Evaluates financial data, supports investment decisions, and improves financial performance.",Stable,Finance,Financial Analysis Basics
Supply Chain Management,"Logistics, Inventory Management, Demand Forecasting","Optimizes supply chain processes, enhances efficiency and reduces costs in product delivery.",Growing,"Manufacturing, Retail",Supply Chain Management Course
Digital Forensics,"Incident Response, Data Recovery, Cybersecurity","Investigates cyber incidents, recovers data, and ensures compliance with legal standards.",High Growth,"Tech, Law Enforcement",Digital Forensics Certification
Customer Experience (CX),"User Research, Journey Mapping, Feedback Analysis","Enhances customer interactions, analyzes feedback to improve overall satisfaction and loyalty.",Growing,All industries,Customer Experience Fundamentals
Talent Acquisition,"Recruiting, Interviewing, Employer Branding","Attracts and selects the right talent, enhances company image, and improves hiring processes.",Growing,All industries,Talent Acquisition Certification
Artificial Neural Networks,"Deep Learning, Data Science, Statistical Analysis","Mimics brain functions for complex problem-solving, enhances AI capabilities.",High Growth,"Tech, Healthcare",Deep Learning with Python
Voice User Interface (VUI) Design,"Interaction Design, User Research, Prototyping","Designs voice-activated systems, enhances user interaction through auditory feedback.",Growing,"Tech, E-commerce",VUI Design Basics
E-commerce Development,"Payment Systems, User Experience, SEO","Builds online retail platforms, enhances shopping experiences, and optimizes visibility.",High Growth,"Retail, Tech",E-commerce Development Course
Data Governance,"Data Quality, Compliance, Metadata Management","Ensures data accuracy and security, supports compliance with regulations, and improves data usage.",Growing,All industries,Data Governance Fundamentals
Wearable Technology,"Sensors, Data Analytics, User Experience","Develops devices that track health metrics, enhances personal data collection and user engagement.",High Growth,"Healthcare, Tech",Wearable Tech Basics
Personal Branding,"Online Presence, Networking, Content Creation","Builds and promotes an individual's professional identity, enhances career opportunities.",Growing,All industries,Personal Branding Workshop
Change Management,"Communication, Stakeholder Engagement, Process Improvement","Manages organizational change effectively, enhances employee buy-in, and minimizes disruption.",Growing,All industries,Change Management Certification
Ethics in Technology,"Privacy, Data Protection, Ethical Hacking","Ensures responsible tech development, promotes user trust, and addresses societal impacts.",Growing,"Tech, Education",Ethics in Technology Course
Artificial Intelligence Ethics,"Bias Mitigation, Accountability, Transparency","Addresses ethical implications of AI, promotes fairness and accountability in AI systems.",High Growth,"Tech, Policy",AI Ethics Basics
Environmental Data Science,"Big Data, Predictive Modeling, GIS","Uses data analysis for environmental monitoring, supports sustainability efforts.",Growing,Environmental Science,Environmental Data Science Course
Crisis Management,"Risk Assessment, Communication Strategies, Recovery Planning","Prepares organizations for unexpected events, minimizes impact, and ensures business continuity.",Growing,All industries,Crisis Management Certification
Behavioral Economics,"Consumer Psychology, Decision Making, Market Research","Studies psychological factors affecting economic decisions, informs marketing strategies.",Growing,"Marketing, Finance",Behavioral Economics Basics
Artificial Intelligence in Healthcare,"Predictive Analytics, Patient Data Management, Telehealth","Improves patient outcomes through data analysis, supports decision-making in healthcare settings.",High Growth,Healthcare,AI in Healthcare Course
Data Analysis,"Data Visualization, SQL, Machine Learning, Statistical Analysis, Data Mining, Data Cleaning","Enhances insights through visuals, enables querying, adds predictive analytics, extracts patterns, and prepares data for analysis.",Growing,"Finance, Marketing","Tableau, Power BI tutorials"
Machine Learning,"Deep Learning, Natural Language Processing, Reinforcement Learning, Computer Vision","Advanced models for text generation and decision-making, enabling machines to interpret visual data.",High Growth,"Healthcare, Tech",Deep Learning Specialization
SQL,"Data Warehousing, NoSQL Databases, ETL, Database Administration","Organizes data for access, processes data for analysis, manages databases.",Stable,"Tech, Manufacturing",Data Warehousing with SQL
Data Visualization,"Dashboard Design, Business Intelligence, Infographic Design, Storytelling with Data","Communicates insights effectively through visuals, integrates analysis into business decisions.",Growing,All industries,Power BI Dashboard
Data Science,"Big Data, Cloud Computing, Data Engineering, Predictive Analytics","Analyzes large datasets, utilizes cloud resources, and uses statistics for forecasting outcomes.",High Growth,"Tech, Finance",Big Data Fundamentals
Project Management,"Agile Methodologies, Risk Management, Resource Management, Stakeholder Management","Supports iterative development, identifies risks, allocates resources, engages stakeholders.",Growing,All industries,Agile Project Management
Cybersecurity,"Network Security, Ethical Hacking, Incident Response, Application Security","Protects data integrity, tests vulnerabilities, manages incidents, secures applications.",High Growth,"Tech, Finance",Cybersecurity Fundamentals
Digital Marketing,"SEO, Content Marketing, Social Media Marketing, Email Marketing","Enhances visibility, engages audiences, builds brand awareness, and drives customer engagement.",High Growth,"E-commerce, Tech",SEO Basics
UX/UI Design,"Interaction Design, Graphic Design, Usability Testing, Prototyping","Improves user interaction, aesthetics, evaluates design effectiveness, and creates prototypes.",Growing,"Tech, E-commerce",Interaction Design Fundamentals
Remote Work Skills,"Time Management, Communication, Self-Motivation","Enhances productivity while working from home, requires adaptability and tech proficiency.",Growing,All industries,Remote Work Best Practices
Data Privacy,"Compliance, Risk Management, Data Protection","Ensures personal and organizational data is secure, adheres to regulations like GDPR.",High Growth,"Tech, Finance",Data Privacy Fundamentals
Chatbot Development,"Natural Language Processing, AI, UX Design","Creates conversational agents for customer service and engagement, enhances user experience.",High Growth,"Tech, E-commerce",Chatbot Development Course
Robotics Process Automation,"Business Process Management, Programming, Data Analysis","Automates repetitive tasks using software robots, increases efficiency in operations.",High Growth,"Tech, Manufacturing",RPA Fundamentals
Digital Content Creation,"Video Editing, Copywriting, Graphic Design",Produces engaging multimedia content for marketing and branding purposes.,Growing,"Marketing, Media",Digital Content Creation Course
Sustainability Reporting,"Data Analysis, Environmental Science, Corporate Strategy","Communicates sustainability performance, enhances transparency and accountability in organizations.",Growing,All industries,Sustainability Reporting Basics
Supply Chain Analytics,"Data Visualization, Statistical Analysis, Forecasting","Uses data to improve supply chain decisions, enhances efficiency and reduces costs.",Growing,"Manufacturing, Retail",Supply Chain Analytics Course
Augmented Reality Development,"3D Modeling, User Experience, Software Development",Creates immersive experiences by overlaying digital content on the real world.,High Growth,"Gaming, Retail",AR Development Fundamentals
Financial Modeling,"Excel, Valuation, Risk Analysis","Constructs representations of a company’s financial performance, aids in decision-making.",Stable,Finance,Financial Modeling Course
User Experience Research,"Usability Testing, Surveys, Data Analysis","Gathers insights on user behavior, informs product design to enhance user satisfaction.",Growing,"Tech, E-commerce",UX Research Basics
Smart Cities Technology,"IoT, Data Analytics, Urban Planning","Implements tech solutions to enhance urban living, improves sustainability and efficiency.",High Growth,Urban Development,Smart Cities Course
Voice Technology,"Speech Recognition, UX Design, AI","Develops applications for voice interaction, enhances user engagement through voice interfaces.",Growing,"Tech, E-commerce",Voice Technology Fundamentals
E-learning Development,"Instructional Design, Multimedia Production, LMS","Creates online educational content, enhances accessibility and engagement in learning.",High Growth,"Education, Tech",E-learning Development Course
Digital Payment Systems,"Blockchain, Security, Financial Technology","Develops and manages digital transaction solutions, enhances security and user convenience.",High Growth,"Finance, Tech",Digital Payments Fundamentals
Technical Support,"Customer Service, Troubleshooting, IT Skills","Assists users in resolving technical issues, ensures smooth operation of technology solutions.",Stable,"Tech, Customer Service",Technical Support Basics
Interactive Media Design,"Game Design, UX/UI, Animation",Creates engaging and interactive digital experiences across platforms.,Growing,"Media, Entertainment",Interactive Media Design Course
Data Engineering,"ETL, Database Management, Big Data","Builds and maintains systems for data storage and processing, supports data analytics efforts.",High Growth,"Tech, Finance",Data Engineering Fundamentals
Personal Finance Management,"Budgeting, Investment Planning, Financial Literacy","Helps individuals manage their finances effectively, enhances financial decision-making skills.",Growing,"Finance, Education",Personal Finance Basics
Social Impact Assessment,"Stakeholder Engagement, Data Analysis, Reporting","Evaluates the social effects of projects, enhances accountability and community engagement.",Growing,"Nonprofits, Government",Social Impact Assessment Course
Cloud Security,"Network Security, Risk Management, Compliance","Protects cloud infrastructure and data, ensures compliance with security regulations.",High Growth,"Tech, Finance",Cloud Security Fundamentals
Event Planning,"Logistics, Marketing, Budgeting","Organizes successful events, manages logistics, and engages participants effectively.",Stable,All industries,Event Planning Basics
Customer Relationship Management (CRM),"Sales, Marketing, Data Analysis","Manages company interactions with current and potential customers, enhances sales and retention.",Growing,All industries,CRM Fundamentals
Pharmaceutical Data Science,"Biostatistics, Machine Learning, Data Analysis",Analyzes clinical data to improve drug development processes and outcomes.,High Growth,Healthcare,Pharmaceutical Data Science Course
Graphic User Interface (GUI) Design,"Interaction Design, Prototyping, Usability Testing","Enhances user interaction with software applications, ensures intuitive design.",Growing,"Tech, Software Development",GUI Design Fundamentals
Agile Coaching,"Scrum, Team Facilitation, Change Management","Guides teams in implementing Agile methodologies, enhances project adaptability and efficiency.",High Growth,"Tech, Consulting",Agile Coaching Certification
Behavioral Health Technology,"Data Analytics, Telehealth, Patient Engagement","Develops tech solutions for mental health support, enhances accessibility to care.",High Growth,Healthcare,Behavioral Health Tech Course
Nanotechnology,"Materials Science, Chemistry, Engineering","Manipulates matter at the nanoscale, develops innovative materials and applications.",Growing,"Tech, Healthcare",Nanotechnology Fundamentals
Culinary Arts,"Food Safety, Menu Development, Nutrition","Prepares and presents food, enhances dining experiences and nutritional value.",Stable,Hospitality,Culinary Arts Basics
Gaming Technology,"Software Development, Game Design, UX/UI","Creates engaging video games, focuses on player experience and technical performance.",High Growth,"Entertainment, Tech",Game Technology Fundamentals
Mobile UX Design,"User Research, Prototyping, Interaction Design","Designs user-friendly mobile applications, enhances usability and engagement.",Growing,"Tech, E-commerce",Mobile UX Design Course
Smart Agriculture,"IoT, Data Analysis, Environmental Science","Implements technology to optimize farming practices, enhances sustainability and productivity.",High Growth,Agriculture,Smart Agriculture Basics
Public Relations,"Media Relations, Crisis Communication, Content Creation","Manages company image and communications, enhances public perception.",Growing,All industries,Public Relations Fundamentals
Content Marketing,"SEO, Social Media, Copywriting",Develops and shares valuable content to attract and engage target audiences.,High Growth,"Marketing, E-commerce",Content Marketing Course
Fashion Design,"Textile Design, Trend Analysis, Marketing","Creates innovative clothing and accessory designs, enhances brand identity and market appeal.",Growing,Fashion,Fashion Design Fundamentals
Biotechnology,"Genetic Engineering, Molecular Biology, Data Analysis","Applies biological systems for innovation in health and agriculture, drives scientific advancement.",High Growth,"Healthcare, Agriculture",Biotechnology Basics
Crisis Communication,"Media Training, Stakeholder Management, Public Speaking","Manages organizational communication during crises, ensures clear messaging and accountability.",Growing,All industries,Crisis Communication Basics
Diversity and Inclusion,"Cultural Competence, Training, Policy Development","Promotes a diverse and inclusive workplace, enhances employee engagement and innovation.",Growing,All industries,Diversity and Inclusion Training
Nonprofit Management,"Fundraising, Program Development, Volunteer Management","Manages nonprofit organizations, enhances community impact and sustainability.",Stable,Nonprofits,Nonprofit Management Basics
Personal Branding,"Networking, Online Presence, Content Creation","Helps individuals establish a professional identity, enhances career opportunities and visibility.",Growing,All industries,Personal Branding Course
Web Accessibility,"UX Design, Compliance, User Research","Ensures websites are usable for people with disabilities, enhances inclusivity and user experience.",Growing,"Tech, E-commerce",Web Accessibility Basics
Data Visualization Tools,"Tableau, Power BI, D3.js","Utilizes software to create visual representations of data, enhances understanding and decision-making.",Growing,"Tech, Finance",Data Visualization Tools Training
Wearable Health Tech,"IoT, Data Analysis, UX Design","Develops devices that monitor health metrics, enhances personal health management.",High Growth,Healthcare,Wearable Health Tech Basics
Geospatial Analysis,"GIS, Remote Sensing, Data Visualization","Analyzes spatial data to inform decisions in urban planning, environmental management, etc.",Growing,"Environmental Science, Tech",Geospatial Analysis Course
Digital Asset Management,"Content Management, Metadata, Data Analysis","Organizes and manages digital assets for marketing and branding, enhances accessibility and efficiency.",Growing,"Marketing, Tech",Digital Asset Management Basics
Cryptocurrency,"Blockchain, Financial Technology, Trading","Manages and trades digital currencies, enhances understanding of decentralized finance.",High Growth,"Finance, Tech",Cryptocurrency Fundamentals
IT Compliance,"Risk Management, Data Privacy, Security Policies","Ensures IT practices meet regulatory standards, enhances organizational security and compliance.",Growing,"Tech, Finance",IT Compliance Basics
Artificial Intelligence in Marketing,"Predictive Analytics, Consumer Behavior, Automation","Uses AI to optimize marketing strategies, enhances targeting and personalization.",High Growth,"Marketing, Tech",AI in Marketing Course
Philanthropy,"Grant Writing, Fundraising, Community Engagement","Manages charitable activities, enhances community impact and support for causes.",Stable,Nonprofits,Philanthropy Basics
Blockchain for Supply Chain,"Smart Contracts, Transparency, Traceability","Enhances transparency and efficiency in supply chain processes, reduces fraud and errors.",High Growth,"Manufacturing, Retail",Blockchain Supply Chain Course
Big Data Analytics,"Data Mining, Machine Learning, Statistical Analysis","Analyzes massive datasets to uncover patterns and insights, supports informed decision-making.",High Growth,"Tech, Finance",Big Data Analytics Course
Content Curation,"Content Strategy, Social Media, SEO","Collects and organizes relevant content to share with audiences, enhances engagement.",Growing,"Marketing, Education",Content Curation Basics
Digital Transformation,"Change Management, Technology Adoption, Process Improvement","Drives organizations to integrate digital technologies, enhances operational efficiency.",High Growth,All industries,Digital Transformation Guide
Mobile Security,"Network Security, Ethical Hacking, Data Protection","Protects mobile devices and applications from security threats, ensures user data safety.",Growing,"Tech, Finance",Mobile Security Fundamentals
Podcasting,"Audio Editing, Storytelling, Marketing","Produces engaging audio content for various audiences, enhances brand storytelling.",Growing,"Media, Marketing",Podcasting Basics
Social Media Advertising,"PPC, Content Creation, Audience Targeting","Manages paid advertising campaigns on social platforms, enhances brand visibility and engagement.",High Growth,"Marketing, E-commerce",Social Media Advertising Course
Design Thinking,"User Research, Prototyping, Iteration","Promotes a user-centered approach to problem-solving, enhances innovation and creativity.",Growing,All industries,Design Thinking Workshop
Artificial Intelligence Ethics,"Bias Mitigation, Transparency, Accountability","Addresses ethical considerations in AI development, promotes fair and responsible technology use.",High Growth,"Tech, Policy",AI Ethics Fundamentals
Augmented Reality Marketing,"Content Creation, User Experience, Technology Integration","Leverages AR technology for immersive marketing experiences, enhances consumer engagement.",High Growth,"Marketing, Retail",AR Marketing Course
Cloud Infrastructure,"Virtualization, Networking, Security","Manages and optimizes cloud computing resources, ensures secure and efficient operations.",High Growth,"Tech, Finance",Cloud Infrastructure Basics
Data Science for Business,"Data Analysis, Predictive Modeling, Visualization","Applies data science techniques to solve business problems, enhances decision-making.",Growing,"Tech, Business",Data Science for Business Course
Smart Home Technology,"IoT, Home Automation, Security Systems","Develops and integrates technologies for automated home systems, enhances convenience and security.",High Growth,"Tech, Home Improvement",Smart Home Tech Basics
Digital Literacy,"Technology Proficiency, Online Safety, Information Evaluation",Empowers individuals to effectively use digital tools and assess information critically.,Growing,"Education, All industries",Digital Literacy Course
Transmedia Storytelling,"Multimedia Production, Marketing, User Engagement","Creates narrative experiences across multiple platforms, enhances audience connection and engagement.",Growing,"Media, Entertainment",Transmedia Storytelling Workshop
Drones Technology,"Robotics, Remote Sensing, Data Analysis","Develops and operates drones for various applications, enhances data collection and monitoring.",High Growth,"Agriculture, Tech",Drone Technology Fundamentals
Telemedicine,"Health Informatics, Patient Care, Data Security","Delivers healthcare services remotely, enhances access to care and patient engagement.",High Growth,Healthcare,Telemedicine Basics
E-commerce Analytics,"Data Analysis, Market Research, Customer Insights","Analyzes e-commerce data to drive sales and optimize user experience, supports strategic decisions.",Growing,"E-commerce, Retail",E-commerce Analytics Course
Behavioral Data Analysis,"Statistical Analysis, Data Visualization, Machine Learning","Examines consumer behavior to inform marketing strategies, enhances customer targeting.",Growing,"Marketing, Tech",Behavioral Data Analysis Basics
Sustainable Design,"Environmental Science, Product Development, User Experience","Integrates eco-friendly practices into design processes, enhances sustainability efforts.",Growing,"Architecture, Product Design",Sustainable Design Course
